<?xml version="1.0" encoding="utf-8" ?>
<doc:data xsi:schemaLocation="/doc ../../Document.xsd" xmlns:doc="/doc" xmlns:xsi="http://www.w3.org/2001/XMLSchema-instance">
	<doc:title>Kontakte</doc:title>
	<doc:sequence>6</doc:sequence>
	<doc:active>1</doc:active>
	<doc:controller></doc:controller>
	<doc:action>Contact</doc:action>
	<doc:description></doc:description>
	<doc:keywords></doc:keywords>
	<doc:robots></doc:robots>
	<doc:og-image></doc:og-image>
	<doc:og-title></doc:og-title>
	<doc:og-description></doc:og-description>
	<doc:itemprop-name></doc:itemprop-name>
	<doc:itemprop-description></doc:itemprop-description>
	<doc:navigation-title></doc:navigation-title>
	<doc:navigation-subtitle>rufen mich gerne an</doc:navigation-subtitle>
	<doc:perex></doc:perex>
	<doc:body>
		<h1><?=$this->title?></h1>
		
	</doc:body>
</doc:data>