<?xml version="1.0" encoding="utf-8" ?>
<doc:data xsi:schemaLocation="/doc ../../Document.xsd" xmlns:doc="/doc" xmlns:xsi="http://www.w3.org/2001/XMLSchema-instance">
	<doc:title>Programmierkurse für Fachkräfte</doc:title>
	<doc:sequence>2</doc:sequence>
	<doc:active>0</doc:active>
	<doc:controller>Fronts\Training</doc:controller>
	<doc:action></doc:action>
	<doc:description></doc:description>
	<doc:keywords></doc:keywords>
	<doc:robots></doc:robots>
	<doc:og-image></doc:og-image>
	<doc:og-title></doc:og-title>
	<doc:og-description></doc:og-description>
	<doc:itemprop-name></doc:itemprop-name>
	<doc:itemprop-description></doc:itemprop-description>
	<doc:navigation-title>Programmierkurse</doc:navigation-title>
	<doc:navigation-subtitle>für Profis</doc:navigation-subtitle>
	<doc:perex></doc:perex>
	<doc:body>
		<h1>{$title}</h1>

	</doc:body>
</doc:data>
